{
  "$schema": "https://github.com/ferrum-edge/ferrum-contracts/schemas/vocabulary-gateway-headers/v1.schema.json",
  "vocabulary": "gateway-headers",
  "version": 1,
  "edge_release": "v0.9.17",
  "description": "HTTP header names and prefixes with Ferrum Edge semantics: gateway assertions, diagnostic response headers, internal markers, mesh control headers, and admin API headers, including standard HTTP ETag and If-Match. Names and prefixes match case-insensitively. Availability records the first Edge tag containing the surface. From Edge v0.9.15 the gateway writes its request assertions after it has resolved a client's Connection nominations at HTTP/1.1 and HTTP/3 ingress; the src/proxy/headers.rs provenance note gives the rule.",
  "provenance": [
    {
      "repo": "ferrum-edge/ferrum-edge",
      "ref": "v0.9.17",
      "commit": "669c574c1d1e88e84dccb26a8159939e6694644d",
      "path": "src/proxy/headers.rs",
      "symbols": [
        "confine_connection_nominated_request_headers",
        "is_retained_connection_option",
        "is_ingress_protected_nominated_field",
        "field_names_equivalent_for_backends"
      ],
      "note": "Connection nominations (ferrum-edge#6090, issue #6087, from v0.9.15): HTTP/1.1 and HTTP/3 ingress removes every field a client's Connection header nominates before any plugin runs, and rewrites Connection to keep only the close option and the request hop-by-hop names connection, keep-alive, proxy-authorization, proxy-connection, te, trailer, transfer-encoding and upgrade. Host, Content-Length, Expect, Forwarded, X-Forwarded-For, X-Forwarded-Host, X-Forwarded-Port, X-Forwarded-Proto, X-Real-IP and the configured FERRUM_REAL_IP_HEADER are protected and keep their client values for routing, framing and trusted-proxy client-IP resolution. A nominated Authorization is removed before authentication. Gateway assertions (consumer identity, X-Authenticated-Identity, claim_headers destinations, X-Geo-Country, path-param captures) and transformer-added headers are written afterwards, so a client nomination cannot remove them. HTTP/2 rejects Connection and is unchanged. Gateway-owned assertion names match ASCII case-insensitively with _ equivalent to - (field_names_equivalent_for_backends), the folding CGI-style backends apply. From v0.9.17, enabled X-Ferrum-Hops is stamped before confinement and protected from Connection nominations, then reasserted after mutable hook phases; the zero-disable passthrough rule is described in its entry."
    },
    {
      "repo": "ferrum-edge/ferrum-edge",
      "ref": "v0.9.17",
      "commit": "669c574c1d1e88e84dccb26a8159939e6694644d",
      "path": "docs/admin_api.md"
    },
    {
      "repo": "ferrum-edge/ferrum-edge",
      "ref": "v0.9.17",
      "commit": "669c574c1d1e88e84dccb26a8159939e6694644d",
      "path": "docs/error_classification.md"
    },
    {
      "repo": "ferrum-edge/ferrum-edge",
      "ref": "v0.9.17",
      "commit": "669c574c1d1e88e84dccb26a8159939e6694644d",
      "path": "docs/plugin_execution_order.md"
    },
    {
      "repo": "ferrum-edge/ferrum-edge",
      "ref": "v0.9.17",
      "commit": "669c574c1d1e88e84dccb26a8159939e6694644d",
      "path": "openapi.yaml"
    },
    {
      "repo": "ferrum-edge/ferrum-edge",
      "ref": "v0.9.17",
      "commit": "669c574c1d1e88e84dccb26a8159939e6694644d",
      "path": "docs/api_specs.md",
      "sections": [
        "x-ferrum-mcp"
      ]
    },
    {
      "repo": "ferrum-edge/ferrum-edge",
      "ref": "v0.9.17",
      "commit": "669c574c1d1e88e84dccb26a8159939e6694644d",
      "path": "src/admin/preconditions.rs",
      "symbols": [
        "resource_etag",
        "quoted",
        "IfMatch"
      ]
    },
    {
      "repo": "ferrum-edge/ferrum-edge",
      "ref": "v0.9.17",
      "commit": "669c574c1d1e88e84dccb26a8159939e6694644d",
      "path": "src/admin/conditional_snapshots.rs",
      "symbols": [
        "consumer_verification",
        "serialize_snapshot",
        "restore"
      ]
    },
    {
      "repo": "ferrum-edge/ferrum-edge",
      "ref": "v0.9.17",
      "commit": "669c574c1d1e88e84dccb26a8159939e6694644d",
      "path": "docs/admin_backup_restore.md",
      "sections": [
        "Conditional snapshots and restore"
      ]
    },
    {
      "repo": "ferrum-edge/ferrum-edge",
      "ref": "v0.9.17",
      "commit": "669c574c1d1e88e84dccb26a8159939e6694644d",
      "path": "src/admin/deployment_mutations.rs",
      "symbols": [
        "snapshot",
        "parse_request",
        "finish"
      ]
    },
    {
      "repo": "ferrum-edge/ferrum-edge",
      "ref": "v0.9.17",
      "commit": "669c574c1d1e88e84dccb26a8159939e6694644d",
      "path": "docs/deployment_mutations.md"
    }
  ],
  "headers": [
    {
      "name": "X-Ferrum-Hops",
      "match": "exact",
      "surface": "proxy",
      "direction": "gateway_to_backend",
      "role": "gateway_assertion",
      "edge_behavior": "From v0.9.17, the HTTP-family frontend checks one unsigned decimal count (absence means zero) before routing and plugins, and stamps received + 1 before Connection confinement. Repeated, empty, signed, fractional, comma-folded or otherwise malformed fields return HTTP 400 or native gRPC INVALID_ARGUMENT. The configured limit defaults to 10, accepts 0-255, and a reached limit returns HTTP 508 or native gRPC FAILED_PRECONDITION. Zero disables parsing, refusal and stamping; a client field then passes through as an ordinary header. Enabled counts are reasserted after request plugins, each gateway-assertion refresh and final backend-header-policy hooks, and protected configured names match ASCII case-insensitively with _ equivalent to -. Local mesh workload delivery checks but preserves the count only when its target is not a gateway listener; missing listener publication fails closed and increments. Request-scoped plugin HTTP calls and mirrors carry the ordinary incremented count; background sinks and shared cache refreshes do not. Opaque TCP/UDP stream relays carry no header. The stamp can add one field after frontend count limits, so the next hop can return 431.",
      "availability": "v0.9.17",
      "sources": [
        {
          "repo": "ferrum-edge/ferrum-edge",
          "ref": "v0.9.17",
          "commit": "669c574c1d1e88e84dccb26a8159939e6694644d",
          "path": "src/proxy/hop_limit.rs"
        },
        {
          "repo": "ferrum-edge/ferrum-edge",
          "ref": "v0.9.17",
          "commit": "669c574c1d1e88e84dccb26a8159939e6694644d",
          "path": "src/proxy/headers.rs"
        },
        {
          "repo": "ferrum-edge/ferrum-edge",
          "ref": "v0.9.17",
          "commit": "669c574c1d1e88e84dccb26a8159939e6694644d",
          "path": "src/proxy/mod.rs"
        },
        {
          "repo": "ferrum-edge/ferrum-edge",
          "ref": "v0.9.17",
          "commit": "669c574c1d1e88e84dccb26a8159939e6694644d",
          "path": "src/plugins/mod.rs"
        },
        {
          "repo": "ferrum-edge/ferrum-edge",
          "ref": "v0.9.17",
          "commit": "669c574c1d1e88e84dccb26a8159939e6694644d",
          "path": "docs/routing.md"
        }
      ]
    }
  ]
}
